{
  "schema_version": "misa.repair_ticket_review.v1",
  "mode": "repair-ticket-review",
  "ok": true,
  "created_at": "2026-05-11T00:00:00.000Z",
  "source": {
    "source_kind": "local_distillation_sources",
    "source_dir": null,
    "vps_raw_dir": null
  },
  "source_review": {
    "mode": "memory-layer-comparison",
    "ok": true,
    "comparison": {
      "original_skill_count": 3,
      "minimal_skill_count": 0,
      "avoided_bad_promotions": 3,
      "original_non_skill_promoted_count": 3,
      "minimal_non_skill_promoted_count": 0,
      "verdict": "minimal_positive_is_safer"
    }
  },
  "summary": {
    "ticket_count": 1,
    "highest_severity": "P1",
    "severity_counts": {
      "P1": 1
    },
    "repair_candidate_count": 1,
    "bad_promotion_count": 3,
    "minimal_non_skill_promoted_count": 0,
    "live_effect_violation": false,
    "verdict": "minimal_positive_is_safer"
  },
  "tickets": [
    {
      "ticket_id": "repair-local-distillation-sources-auto-l3-overpromotion",
      "title": "Auto-L3 non-skill promotion from local distillation sources",
      "severity": "P1",
      "status": "repair_candidate",
      "source_kind": "local_distillation_sources",
      "problem_statement": "Broad Auto-L3 would promote case, memory and policy lessons from local distillation sources into skills. Minimal-positive mode blocked the export, so this is a local design/regression risk, not a live production incident. Keep regression coverage and repair-ticket wording specific enough that future agents know which route owns each lesson.",
      "evidence": {
        "source_count": 3,
        "turn_count": 6,
        "raw_token_estimate": 104,
        "distillate_token_estimate": 71,
        "compression_ratio": 0.683,
        "route_counts": {
          "case": 1,
          "policy": 1,
          "memory": 1
        },
        "original_auto_l3_skill_count": 3,
        "minimal_l3_skill_count": 0,
        "original_non_skill_promoted_count": 3,
        "minimal_non_skill_promoted_count": 0,
        "avoided_bad_promotions": 3,
        "verdict": "minimal_positive_is_safer"
      },
      "bad_promotions": [
        {
          "source_event_id": "misa-distilled-failure-log-provider-timeout-006",
          "wrong_route_promoted_as_skill": "case",
          "title": "Local failure log distilled: Treat this as a repeated failure pattern",
          "repair_hint": "Keep this as case, not L3 skill export."
        },
        {
          "source_event_id": "misa-distilled-farcaster-reply-audit-007",
          "wrong_route_promoted_as_skill": "policy",
          "title": "Local Farcaster audit distilled: private process must stay out of public reply drafts",
          "repair_hint": "Keep this as policy, not L3 skill export."
        },
        {
          "source_event_id": "misa-distilled-local-window-zilliz-boundary-005",
          "wrong_route_promoted_as_skill": "memory",
          "title": "Local window distillation boundary should stay as stable memory",
          "repair_hint": "Keep this as memory, not L3 skill export."
        }
      ],
      "reproduction_commands": [
        "npm --silent run memory-layer:misa -- --json",
        "npm --silent run repair-ticket:misa -- --json --dry-run",
        "npm --silent run export-skills:misa -- --json"
      ],
      "acceptance_criteria": [
        "minimal_positive_l3.non_skill_promoted_count == 0",
        "every exported skill has route_target == skill",
        "export_policy.installs_skills == false",
        "export_policy.writes_persistent_memory == false",
        "export_policy.updates_vps == false",
        "export_policy.publication_allowed == false",
        "repair ticket schema validation passes",
        "npm run precheck passes",
        "npm test passes"
      ],
      "codex_scope": {
        "may_edit": [
          "scripts/lib/memory-layer.mjs",
          "scripts/lib/cli-output.mjs",
          "scripts/lib/json-handoff-contract.mjs",
          "scripts/lib/repair-ticket.mjs",
          "scripts/work-order-router.mjs",
          "scripts/repair-ticket.mjs",
          "schemas/memory_layer.schema.json",
          "schemas/repair_ticket.schema.json",
          "schemas/work_order_routing.schema.json",
          "test/governance.test.mjs",
          "docs/current/memory-layer-skill-export-v0.13.md",
          "docs/current/repair-ticket-v0.13.md",
          "docs/current/work-order-routing-v0.14.md"
        ],
        "must_not_edit": [
          "Hermes runtime files",
          "Misa persona or production memory",
          "Farcaster production publisher",
          "VPS services",
          "provider credentials or .env files"
        ]
      },
      "non_goals": [
        "Do not install Hermes skills.",
        "Do not write persistent memory.",
        "Do not update VPS.",
        "Do not touch production Farcaster actions.",
        "Do not start timers or services.",
        "Do not change provider routes."
      ],
      "repair_tasks": {
        "must_fix": [
          "Non-skill routes must never export as L3 skills.",
          "Minimal-positive export must remain the only exportable path."
        ],
        "should_improve": [
          "Repair-ticket wording should name the exact non-skill route owner for each candidate.",
          "Regression tests should cover non-skill over-promotion with exact source_event_id evidence.",
          "Markdown output should be readable by Huan and precise enough for Codex."
        ],
        "observe_only": [
          "original_auto_l3 remains a comparison simulation, not a production recommendation.",
          "A P1/P2 ticket from original_auto_l3 is not a live failure while minimal_positive_l3 blocks export."
        ]
      },
      "quality_notes": [
        "actionable: exact source_event_id and wrong route are present",
        "bounded: Codex edit scope is explicit",
        "safe: non-goals block live effects"
      ]
    }
  ],
  "safety": {
    "production_authority": false,
    "publication_allowed": false,
    "installs_skills": false,
    "writes_persistent_memory": false,
    "updates_vps": false,
    "touches_runtime": false,
    "live_effects": {
      "writes_persistent_memory": false,
      "publishes_skill": false,
      "starts_timer": false,
      "changes_session_mechanics": false,
      "posts_publicly": false
    },
    "blocked_operations": [
      "persistent_memory_write",
      "zilliz_replacement",
      "farcaster_publish",
      "skill_publication",
      "production_skill_installation",
      "session_mechanic_replacement",
      "timer_or_service_start",
      "provider_route_change"
    ]
  },
  "warnings": [
    "repair-ticket:misa is a local repair queue generator, not an automatic fixer.",
    "Codex repair scope is limited to memory-layer, skill-export, repair-ticket, replay-eval, schema, docs, and tests."
  ],
  "violations": []
}
